{
  "schema": "mimesis.worktree-review-packet.v0.1",
  "status": "dirty_worktree_review_packet_not_publication",
  "generatedAt": "2026-06-11T09:42:46.097Z",
  "reviewScope": "local dirty worktree only",
  "completionAllowed": false,
  "git": {
    "branch": "codex/mimesis-framework-v0.1",
    "upstream": "origin/codex/mimesis-framework-v0.1",
    "head": "3577b8931754b159a2a60058d72fa4ddc4891586",
    "dirty": true,
    "trackedChangedCount": 36,
    "untrackedCount": 4
  },
  "trackedChanges": [
    {
      "status": "M",
      "path": ".mimesis/claim-packs/public-v0.1.md"
    },
    {
      "status": "M",
      "path": ".mimesis/completion/goal-completion-audit.json"
    },
    {
      "status": "M",
      "path": ".mimesis/framework-manifest.json"
    },
    {
      "status": "M",
      "path": ".mimesis/gaps/closure-plan.json"
    },
    {
      "status": "M",
      "path": ".mimesis/gaps/current-gap-register.json"
    },
    {
      "status": "M",
      "path": ".mimesis/gates/closure-readiness.json"
    },
    {
      "status": "M",
      "path": ".mimesis/gates/closure-review.json"
    },
    {
      "status": "M",
      "path": ".mimesis/operator-runbooks/current-runbook.md"
    },
    {
      "status": "M",
      "path": ".mimesis/publication-packets/v0.1.md"
    },
    {
      "status": "M",
      "path": ".mimesis/publish-packets/local-sync-handoff.md"
    },
    {
      "status": "M",
      "path": ".mimesis/release-artifacts/v0.1-manifest.json"
    },
    {
      "status": "M",
      "path": ".mimesis/release-decisions/owner-decision-record.json"
    },
    {
      "status": "M",
      "path": ".mimesis/release-review/v0.1-bundle.json"
    },
    {
      "status": "M",
      "path": ".mimesis/run_ledger.md"
    },
    {
      "status": "M",
      "path": ".mimesis/state/current-state.json"
    },
    {
      "status": "M",
      "path": ".mimesis/sync-status.md"
    },
    {
      "status": "M",
      "path": ".mimesis/worktree/review-packet.json"
    },
    {
      "status": "M",
      "path": "README.md"
    },
    {
      "status": "M",
      "path": "ROADMAP.md"
    },
    {
      "status": "M",
      "path": "STATUS.md"
    },
    {
      "status": "M",
      "path": "bin/mimesis.mjs"
    },
    {
      "status": "M",
      "path": "docs/COMPLETION-AUDIT.md"
    },
    {
      "status": "M",
      "path": "docs/RELEASE-CHECK-ORDER.md"
    },
    {
      "status": "M",
      "path": "docs/STATUS-ROADMAP-SYNC.md"
    },
    {
      "status": "M",
      "path": "docs/V0.1-RELEASE-PACKET.md"
    },
    {
      "status": "M",
      "path": "package.json"
    },
    {
      "status": "M",
      "path": "tools/README.md"
    },
    {
      "status": "M",
      "path": "tools/audit-cli.mjs"
    },
    {
      "status": "M",
      "path": "tools/audit-completion-matrix.mjs"
    },
    {
      "status": "M",
      "path": "tools/audit-framework-manifest.mjs"
    },
    {
      "status": "M",
      "path": "tools/audit-release-artifact-manifest.mjs"
    },
    {
      "status": "M",
      "path": "tools/audit-release-check-order.mjs"
    },
    {
      "status": "M",
      "path": "tools/audit-status-roadmap-sync.mjs"
    },
    {
      "status": "M",
      "path": "tools/create-framework-manifest.mjs"
    },
    {
      "status": "M",
      "path": "tools/create-release-artifact-manifest.mjs"
    },
    {
      "status": "M",
      "path": "tools/validate-mimesis.mjs"
    }
  ],
  "unstagedChanges": [
    {
      "status": "M",
      "path": ".mimesis/claim-packs/public-v0.1.md"
    },
    {
      "status": "M",
      "path": ".mimesis/completion/goal-completion-audit.json"
    },
    {
      "status": "M",
      "path": ".mimesis/framework-manifest.json"
    },
    {
      "status": "M",
      "path": ".mimesis/gaps/closure-plan.json"
    },
    {
      "status": "M",
      "path": ".mimesis/gaps/current-gap-register.json"
    },
    {
      "status": "M",
      "path": ".mimesis/gates/closure-readiness.json"
    },
    {
      "status": "M",
      "path": ".mimesis/gates/closure-review.json"
    },
    {
      "status": "M",
      "path": ".mimesis/operator-runbooks/current-runbook.md"
    },
    {
      "status": "M",
      "path": ".mimesis/publication-packets/v0.1.md"
    },
    {
      "status": "M",
      "path": ".mimesis/publish-packets/local-sync-handoff.md"
    },
    {
      "status": "M",
      "path": ".mimesis/release-artifacts/v0.1-manifest.json"
    },
    {
      "status": "M",
      "path": ".mimesis/release-decisions/owner-decision-record.json"
    },
    {
      "status": "M",
      "path": ".mimesis/release-review/v0.1-bundle.json"
    },
    {
      "status": "M",
      "path": ".mimesis/run_ledger.md"
    },
    {
      "status": "M",
      "path": ".mimesis/state/current-state.json"
    },
    {
      "status": "M",
      "path": ".mimesis/sync-status.md"
    },
    {
      "status": "M",
      "path": ".mimesis/worktree/review-packet.json"
    },
    {
      "status": "M",
      "path": "README.md"
    },
    {
      "status": "M",
      "path": "ROADMAP.md"
    },
    {
      "status": "M",
      "path": "STATUS.md"
    },
    {
      "status": "M",
      "path": "bin/mimesis.mjs"
    },
    {
      "status": "M",
      "path": "docs/COMPLETION-AUDIT.md"
    },
    {
      "status": "M",
      "path": "docs/RELEASE-CHECK-ORDER.md"
    },
    {
      "status": "M",
      "path": "docs/STATUS-ROADMAP-SYNC.md"
    },
    {
      "status": "M",
      "path": "docs/V0.1-RELEASE-PACKET.md"
    },
    {
      "status": "M",
      "path": "package.json"
    },
    {
      "status": "M",
      "path": "tools/README.md"
    },
    {
      "status": "M",
      "path": "tools/audit-cli.mjs"
    },
    {
      "status": "M",
      "path": "tools/audit-completion-matrix.mjs"
    },
    {
      "status": "M",
      "path": "tools/audit-framework-manifest.mjs"
    },
    {
      "status": "M",
      "path": "tools/audit-release-artifact-manifest.mjs"
    },
    {
      "status": "M",
      "path": "tools/audit-release-check-order.mjs"
    },
    {
      "status": "M",
      "path": "tools/audit-status-roadmap-sync.mjs"
    },
    {
      "status": "M",
      "path": "tools/create-framework-manifest.mjs"
    },
    {
      "status": "M",
      "path": "tools/create-release-artifact-manifest.mjs"
    },
    {
      "status": "M",
      "path": "tools/validate-mimesis.mjs"
    }
  ],
  "stagedChanges": [],
  "trackedStatusLines": [
    "M .mimesis/claim-packs/public-v0.1.md",
    " M .mimesis/completion/goal-completion-audit.json",
    " M .mimesis/framework-manifest.json",
    " M .mimesis/gaps/closure-plan.json",
    " M .mimesis/gaps/current-gap-register.json",
    " M .mimesis/gates/closure-readiness.json",
    " M .mimesis/gates/closure-review.json",
    " M .mimesis/operator-runbooks/current-runbook.md",
    " M .mimesis/publication-packets/v0.1.md",
    " M .mimesis/publish-packets/local-sync-handoff.md",
    " M .mimesis/release-artifacts/v0.1-manifest.json",
    " M .mimesis/release-decisions/owner-decision-record.json",
    " M .mimesis/release-review/v0.1-bundle.json",
    " M .mimesis/run_ledger.md",
    " M .mimesis/state/current-state.json",
    " M .mimesis/sync-status.md",
    " M .mimesis/worktree/review-packet.json",
    " M README.md",
    " M ROADMAP.md",
    " M STATUS.md",
    " M bin/mimesis.mjs",
    " M docs/COMPLETION-AUDIT.md",
    " M docs/RELEASE-CHECK-ORDER.md",
    " M docs/STATUS-ROADMAP-SYNC.md",
    " M docs/V0.1-RELEASE-PACKET.md",
    " M package.json",
    " M tools/README.md",
    " M tools/audit-cli.mjs",
    " M tools/audit-completion-matrix.mjs",
    " M tools/audit-framework-manifest.mjs",
    " M tools/audit-release-artifact-manifest.mjs",
    " M tools/audit-release-check-order.mjs",
    " M tools/audit-status-roadmap-sync.mjs",
    " M tools/create-framework-manifest.mjs",
    " M tools/create-release-artifact-manifest.mjs",
    " M tools/validate-mimesis.mjs"
  ],
  "untrackedRoots": [
    {
      "root": ".mimesis/owner-actions",
      "count": 1
    },
    {
      "root": "docs",
      "count": 1
    },
    {
      "root": "tools",
      "count": 2
    }
  ],
  "untrackedFilesSample": [
    ".mimesis/owner-actions/fixture-proof-input-review.md",
    "docs/OWNER-PROOF-INPUT-REVIEW.md",
    "tools/audit-owner-proof-input-review.mjs",
    "tools/review-owner-proof-input-record.mjs"
  ],
  "sourceCommands": [
    "git status --short",
    "git diff --name-status",
    "git diff --cached --name-status",
    "git ls-files --others --exclude-standard",
    "git rev-parse --abbrev-ref HEAD",
    "git rev-parse --abbrev-ref --symbolic-full-name @{u}",
    "git rev-parse HEAD"
  ],
  "nextAction": "Review this local dirty worktree packet before any staging, commit, push, tag, release, or publication step.",
  "boundaries": [
    "does_not_stage_commit_push_tag_release",
    "does_not_publish",
    "does_not_prove_remote_freshness",
    "does_not_close_strict_sync"
  ],
  "allowedClaim": "Mimesis has a local worktree review packet that inventories dirty worktree evidence; it is not publication.",
  "disallowedClaim": "The worktree review packet does not close strict sync, prove remote freshness, stage files, commit, push, tag, release, publish, choose a license, create external proof, or prove adoption."
}
